{
  "version": "1.0",
  "project": "《借天改命账》",
  "volume": 1,
  "window": {
    "start": 1,
    "end": 10,
    "name": "灰雨错账"
  },
  "status": "production_ready",
  "start_snapshot": [
    "陆沉渊仍是泥灯巷病弱少年，只能辨认本地灰痕和普通命印，识账必然反噬身体。",
    "顾家折记即将按册落印，泥灯巷住户没有改变命籍记录的程序权力。",
    "苏晚与巷中住户拒绝以命火换取便利，彼此之间尚未形成稳定见证关系。"
  ],
  "end_target": [
    "顾家错压的一笔命火完成有限返还，但原债、折记与留衙户灯均未被一并消除。",
    "陆沉渊、莫井兰与苏晚建立只陈述亲见事实、允许拒绝和撤回的见证边界。",
    "异常残页、陶片、追缴纸与灰痕形成可继续复验的证据链，命籍衙程序进入下一轮收紧。",
    "识账反噬明显加重，陆沉渊无法依靠连续施术无代价推进调查。"
  ],
  "chapters": [
    {
      "chapter_id": "chapter-0001",
      "working_title": "灰雨里的错账",
      "event": "灰雨核验中，陆沉渊辨出顾家折三补墨灰痕与顾婶命灯寿痕并非同源。",
      "scene_anchor": "灰雨巷口的顾家命灯",
      "conflict": "当场指出错账可能暂缓落印，也会使陆沉渊成为命籍衙重点核验的异常者。",
      "character_choice": "陆沉渊只说明灰痕错位，不声称自己已经查明改账者或完整因果。",
      "irreversible_change": "顾家折记被暂缓至午后复核，陆沉渊眼角焦黑纹路首次无法遮掩。",
      "emotional_turn": "孤立旁观转为冒险承担在场责任。",
      "hook_out": "午后复核将要求更多见证与更明确的在场代价。",
      "expected_state_deltas": ["顾家折记暂缓", "识账反噬加重"],
      "required_asset_ids": ["character_lu_chenyuan", "npc_registrar_qiu_shen", "technique_ledger_recognition", "state_ledger_protagonist_strain"],
      "source_status": "accepted_calibration"
    },
    {
      "chapter_id": "chapter-0002",
      "working_title": "午后再核",
      "event": "午后复核把户灯寿纹、补墨灰痕与莫井兰守灯口述并列写入本地附录。",
      "scene_anchor": "午后命籍衙复核桌",
      "conflict": "形成附录可以保住错位线索，却不足以改账，并会把见证人锁入后续传核。",
      "character_choice": "莫井兰只作可撤回口述，顾婶只确认亲眼所见，拒绝献灯抵命。",
      "irreversible_change": "错位线索取得程序记录但不构成改账依据，陆沉渊被纳入后续残籍复核。",
      "emotional_turn": "求一个结论转为共同守住证词边界。",
      "hook_out": "苏晚手背出现新的灰雨红点，下一次核验转向她的命灯。",
      "expected_state_deltas": ["本地复核附录建立", "陆沉渊进入传核范围"],
      "required_asset_ids": ["npc_mo_jinglan", "bond_mudlamp_lane_trust", "state_ledger_revealed_account_errors", "foreshadowing_cinder_seal_rain"],
      "source_status": "accepted_calibration"
    },
    {
      "chapter_id": "chapter-0003",
      "working_title": "灯与陶片",
      "event": "苏晚验灯与顾家灰屑陶片同场复核，灰痕之间留下不能被补写的冷灰空白。",
      "scene_anchor": "验灯台旁的灰屑陶片",
      "conflict": "交出陶片可换取衙门封存，却会失去见证人对物证离场和解释范围的控制。",
      "character_choice": "莫井兰暂带陶片且只确认灰痕差异，苏晚接受验灯但不允许结果代替改账证据。",
      "irreversible_change": "陶片进入可追溯保管，苏晚命灯失温加重，冷金小印带走一粒异常灰。",
      "emotional_turn": "对物证的依赖转为对保管权的警惕。",
      "hook_out": "明日辰时必须带齐顾家口述与陶片，缺一便按拒验续记。",
      "expected_state_deltas": ["陶片由莫井兰暂带", "苏晚命灯失温"],
      "required_asset_ids": ["npc_mo_jinglan", "npc_su_wan", "bond_mother_su_wan", "foreshadowing_cinder_seal_rain"],
      "source_status": "accepted_calibration"
    },
    {
      "chapter_id": "chapter-0004",
      "working_title": "谁也不替谁作证",
      "event": "辰时通知扩大到泥灯巷护阵旁观，住户逐一限定自己愿意承担的见证范围。",
      "scene_anchor": "夜间泥灯裂座与通知薄纸",
      "conflict": "无人认领旁观会被记成无证护阵，集体代证又会让未亲见之事进入程序记录。",
      "character_choice": "陆沉渊、苏晚和莫井兰分别拒绝替他人认灰、抵命或交出陶片。",
      "irreversible_change": "护阵灯座裂为两道，住户未投入任何命火，旁观责任正式写入通知。",
      "emotional_turn": "互相提防转为承认彼此拒绝的权利。",
      "hook_out": "灯罩黑点避开冷金印位，护阵旁观残页出现异常空白。",
      "expected_state_deltas": ["护阵裂口扩大", "住户拒绝投入命火"],
      "required_asset_ids": ["faction_mudlamp_lane", "faction_life_registry_office", "bond_mudlamp_lane_trust", "npc_su_wan"],
      "source_status": "accepted_calibration"
    },
    {
      "chapter_id": "chapter-0005",
      "working_title": "残页的时差",
      "event": "辰时复核发现旁观残页署时旁灰浮在新墨上，与昨夜追加的程序次序无法同时成立。",
      "scene_anchor": "辰时残页与冷金印下",
      "conflict": "揭开时差可阻止残页直接归档，也会迫使命籍衙把核验压力转向午后现场。",
      "character_choice": "莫井兰保留前三句亲见口述，拒绝补写灰的未知来源。",
      "irreversible_change": "护阵旁观残页改列次序待核，午后泥灯巷现场重验成为强制程序。",
      "emotional_turn": "被动应验转为用不完整证词抵抗完整指控。",
      "hook_out": "午后须同时核对陶片、留衙户灯与护阵落点。",
      "expected_state_deltas": ["残页进入次序待核", "午后现场重验启动"],
      "required_asset_ids": ["npc_registrar_qiu_shen", "npc_mo_jinglan", "state_ledger_revealed_account_errors", "technique_ledger_recognition"],
      "source_status": "accepted_calibration"
    },
    {
      "chapter_id": "chapter-0006",
      "working_title": "陶片不入封",
      "event": "午后重验中，陆沉渊以自身在场认痕换取陶片不进入命籍衙封存。",
      "scene_anchor": "午后泥灯落点重验圈",
      "conflict": "保住陶片的见证独立性需要陆沉渊公开承担识账反噬与后续监督责任。",
      "character_choice": "陆沉渊只认三处灰痕差异，莫井兰不替他的判断担保并继续自行携带陶片。",
      "irreversible_change": "本地残页暂不改、陶片不入衙封，新的监督追缴程序被排入次日。",
      "emotional_turn": "保护物证转为共同承担物证不被占有的代价。",
      "hook_out": "泥灯只剩火星，命籍衙将在卯前送达新的追缴纸。",
      "expected_state_deltas": ["陶片保持外部保管", "监督追缴升级"],
      "required_asset_ids": ["character_lu_chenyuan", "npc_mo_jinglan", "faction_life_registry_office", "state_ledger_protagonist_strain"],
      "source_status": "accepted_calibration"
    },
    {
      "chapter_id": "chapter-0007",
      "working_title": "三处不同的灰",
      "event": "卯前送达时，陆沉渊公开区分灯座裂缝灰、薄纸新压灰与陶片补墨边灰。",
      "scene_anchor": "卯前巷口的三处灰痕",
      "conflict": "说出差异能阻止证据被合并，却无法解释来源，并会强化三人必须到衙的程序锁定。",
      "character_choice": "陆沉渊停用识账只作肉眼判断，苏晚接纸但继续拒绝验灯。",
      "irreversible_change": "三处灰不得被认作同一来源，次日午前三人到衙成为正式要求。",
      "emotional_turn": "追求来源转为先阻止错误归并。",
      "hook_out": "仇慎离开后折返巷口，追缴纸尚未贴门。",
      "expected_state_deltas": ["三处灰痕完成区分", "三人到衙要求生效"],
      "required_asset_ids": ["character_lu_chenyuan", "npc_su_wan", "npc_mo_jinglan", "technique_ledger_recognition"],
      "source_status": "accepted_calibration"
    },
    {
      "chapter_id": "chapter-0008",
      "working_title": "字下旧灰",
      "event": "追缴纸贴门前的旧灰被识出沉在新字下方，并绕开尚未落下的本地印位。",
      "scene_anchor": "门板偏印与字下旧灰",
      "conflict": "旧灰证明纸面次序异常，却仍不能归于陶片、户灯或具体执行者。",
      "character_choice": "陆沉渊把判断止于先后次序，苏晚在反噬加重时阻止他继续追查。",
      "irreversible_change": "追缴纸以偏印贴门并写入次序待核，次日先验纸面异常。",
      "emotional_turn": "证明冲动转为接受证据能力的边界。",
      "hook_out": "灯座裂缝爆响，黑点第二道细线抵住护阵裂口。",
      "expected_state_deltas": ["追缴纸次序待核", "陆沉渊停止继续识账"],
      "required_asset_ids": ["character_lu_chenyuan", "npc_su_wan", "faction_life_registry_office", "foreshadowing_cinder_seal_rain"],
      "source_status": "accepted_calibration"
    },
    {
      "chapter_id": "chapter-0009",
      "working_title": "两道相反的痕",
      "event": "命籍衙复验确认残页灰与追缴纸灰方向相反，两者不能被认定为同源。",
      "scene_anchor": "命审台中央的异常残页",
      "conflict": "分离两道灰痕能保住反证，却换不回顾家户灯，也不能直接撤销折记。",
      "character_choice": "莫井兰拒绝让陶片接触命审台，陆沉渊只确认方向差异而不判断个人归属。",
      "irreversible_change": "异常残页被单独暂扣且不再按普通破损记录，顾家户灯继续留衙。",
      "emotional_turn": "期待翻案转为守住一项不能被抹平的异常。",
      "hook_out": "次日午后将把异常残页与陆沉渊的在场认痕并置复验。",
      "expected_state_deltas": ["异常残页单独封存", "两处灰痕排除同源"],
      "required_asset_ids": ["npc_registrar_qiu_shen", "npc_mo_jinglan", "state_ledger_half_life_registry_exposure", "state_ledger_revealed_account_errors"],
      "source_status": "accepted_calibration"
    },
    {
      "chapter_id": "chapter-0010",
      "working_title": "退还一笔命火",
      "event": "在场认痕与残页灰线之间的断口迫使命籍衙把苏晚被错压的一笔命火有限退回。",
      "scene_anchor": "返还附录与失光冷金印",
      "conflict": "接受有限返还可以救回一笔命火，却不能借机声称原债、顾家折记或全部错账已经解决。",
      "character_choice": "苏晚明确只收本次错压返还，陆沉渊不把断口扩张成无法证明的接触结论。",
      "irreversible_change": "苏晚命灯收回一笔错压命火，返还附录与异常残页分别封记，冷金小印大幅失光。",
      "emotional_turn": "第一次兑现带来希望，也确认长期对抗不能靠一次翻盘完成。",
      "hook_out": "明日申前复验继续，泥灯护阵裂口与住户命火压力仍未解除。",
      "expected_state_deltas": ["苏晚错压命火有限返还", "返还附录独立封记", "冷金小印失光加重"],
      "required_asset_ids": ["npc_su_wan", "npc_registrar_qiu_shen", "bond_mother_su_wan", "state_ledger_poorcity_returnfire"],
      "source_status": "accepted_calibration"
    }
  ]
}
